{
  "schema_version": "1.0",
  "ticket_id": "AUTH-101",
  "test_file": "import { test } from '@playwright/test';\n\n// generated test file text\n",
  "manifest": {
    "reused": [
      {
        "step_id": "step_0123456789abcdef01234567",
        "kind": "action",
        "language": "typescript",
        "name": "submit_credentials",
        "page_object": "LoginPage",
        "intent": "Submit email and password",
        "score": 0.93
      }
    ],
    "new": [
      {
        "kind": "assertion",
        "language": "typescript",
        "name": "sees_dashboard",
        "intent": "Dashboard is shown",
        "page_object": "DashboardPage",
        "params": [],
        "body": [
          "await expect(this.page.getByRole('heading', { name: 'Dashboard' })).toBeVisible();"
        ]
      }
    ]
  },
  "warnings": [
    "step library search failed for 'open login': timeout"
  ]
}
